{
  "statement": "Bonded identity state does not by itself authorize delegated action. Runtime delegation remains a separate control-plane decision.",
  "authority_type": "sponsor",
  "authoritative_party": "Example Sponsor Authority",
  "authority_id": "did:web:example.invalid:sponsor-authority",
  "delegation_required": true,
  "delegation_chain": [
    {
      "delegator": "Example Sponsor Authority",
      "delegate": "Example Agent Beta",
      "scope": [
        "identity-state",
        "bond-status"
      ],
      "artifact_uri": "https://example.invalid/agents/beta/delegation.json",
      "valid_from": "2026-03-25T00:00:00Z",
      "valid_until": "2026-06-25T00:00:00Z",
      "status": "active"
    }
  ],
  "revocation_actor": "Example Sponsor Authority",
  "revocation_uri": "https://example.invalid/agents/beta/revocation",
  "revocation": {
    "revocation_actor": "Example Sponsor Authority",
    "revocation_uri": "https://example.invalid/agents/beta/revocation",
    "status_check_required": true,
    "fresh_until": "2026-04-01T00:00:00Z",
    "status_values": [
      "active",
      "suspended",
      "revoked"
    ]
  },
  "scope": [
    "identity-state",
    "registry-discovery"
  ],
  "scope_constraints": [
    {
      "constraint": "The profile may establish sponsor-backed identity posture but MUST NOT be treated as task authorization.",
      "applies_to": [
        "runtime-delegation",
        "high-risk-action"
      ],
      "evidence_required": true
    }
  ],
  "relying_party_constraints": [
    "Verify revocation status before relying on the boundary.",
    "Require a separate delegation artifact before authorizing runtime action."
  ],
  "evidence_references": [
    {
      "uri": "https://example.invalid/anab/example.agent.beta/evidence.json",
      "media_type": "application/json",
      "sha256": "2222222222222222222222222222222222222222222222222222222222222222",
      "role": "evidence",
      "fresh_until": "2026-06-25T00:00:00Z"
    }
  ],
  "notes": "Reusable authority-boundary contract for AIS-1, A2A-bound trust artifacts, and downstream decision receipts."
}
